Ajani Goldmane,2WW,4,0,4,M,Planeswalker - Ajani,"+1: You gain 2 life.

-1: Put a +1/+1 counter on each creature you control. Those creatures gain vigilance until end of turn.

-6: Put a white Avatar creature token onto the battlefield with ""This creature's power and toughness are each equal to your life total."""
Overrun,2GGG,5,0,0,U,Sorcery,"Creatures you control get +3/+3 and gain trample until end of turn. (If a creature you control would deal enough combat damage to its blockers to destroy them, you may have it deal the rest of its damage to defending player or planeswalker.)"
Prized Unicorn,3G,4,0,0,U,Creature - Unicorn,All creatures able to block Prized Unicorn do so.
Protean Hydra,XG,2,0,0,M,Creature - Hydra,"Protean Hydra enters the battlefield with X +1/+1 counters on it.

If damage would be dealt to Protean Hydra, prevent that damage and remove that many +1/+1 counters from it.

Whenever a +1/+1 counter is removed from Protean Hydra, put two +1/+1 counters on it at the beginning of the end step."
Rampant Growth,1G,2,0,0,C,Sorcery,Search your library for a basic land card and put that card onto the battlefield tapped. Then shuffle your library.
Regenerate,1G,2,0,0,C,Instant,Regenerate target creature.
Runeclaw Bears,1G,2,0,0,C,Creature - Bear,""
Stampeding Rhino,4G,5,0,0,C,Creature - Rhino,"Trample (If this creature would deal enough damage to its blockers to destroy them, you may have it deal the rest of its damage to defending player or planeswalker.)"
Windstorm,XG,2,0,0,U,Instant,Windstorm deals X damage to each creature with flying.
Angel's Feather,2,2,0,0,U,Artifact,"Whenever a player casts a white spell, you may gain 1 life."
Coat of Arms,5,5,0,0,R,Artifact,"Each creature gets +1/+1 for each other creature on the battlefield that shares a creature type with it. (For example, if a Goblin Warrior, a Goblin Scout, and a Zombie Goblin are on the battlefield, each gets +2/+2.)"
Darksteel Colossus,11,11,0,11,M,Artifact Creature - Golem,"Trample

Darksteel Colossus is indestructible. (""Destroy"" effects and lethal damage don't destroy it.)

If Darksteel Colossus would be put into a graveyard from anywhere, reveal Darksteel Colossus and shuffle it into its owner's library instead."
Demon's Horn,2,2,0,0,U,Artifact,"Whenever a player casts a black spell, you may gain 1 life."
Dragon's Claw,2,2,0,0,U,Artifact,"Whenever a player casts a red spell, you may gain 1 life."
Gorgon Flail,2,2,0,0,U,Artifact - Equipment,"Equipped creature gets +1/+1 and has deathtouch.

Equip 2"
Howling Mine,2,2,0,0,R,Artifact,"At the beginning of each player's draw step, if Howling Mine is untapped, that player draws an additional card."
Kraken's Eye,2,2,0,0,U,Artifact,"Whenever a player casts a blue spell, you may gain 1 life."
Magebane Armor,3,3,0,0,R,Artifact - Equipment,"Equipped creature gets +2/+4 and loses flying.

Prevent all noncombat damage that would be dealt to equipped creature.

Equip 2(2: Attack to target creature you control. Equip only as a sorcery.)"
Mirror of Fate,5,5,0,0,R,Artifact,"T, Sacrifice Mirror of Fate: Choose up to seven face-up exiled cards you own. Exile all the cards from your library, then put the chosen cards on top of your library."
Ornithopter,0,0,0,2,U,Artifact Creature - Thopter,Flying (This creature can't be blocked except by creatures with flying or reach.)
Pithing Needle,1,1,0,0,R,Artifact,"As Pithing Needle enters the battlefield, name a card.

Activated abilities of sources with the chosen name can't be activated unless they're mana abilities."
Platinum Angel,7,7,0,4,M,Artifact Creature - Angel,"Flying

You can't lose the game and your opponents can't win the game."
Rod of Ruin,4,4,0,0,U,Artifact,"3, T: Rod of Ruin deals 1 damage to target creature or player."
Spellbook,0,0,0,0,U,Artifact,You have no maximum hand size.
Whispersilk Cloak,3,3,0,0,U,Artifact - Equipment,"Equipped creature is unblockable and has shroud. (It can't be the target of spells or abilities.)

Equip 2(2: Attach to target creature you control. Equip only as a sorcery.)"
Wurm's Tooth,2,2,0,0,U,Artifact,"Whenever a player casts a green spell, you may gain 1 life."
Dragonskull Summit,"",0,0,0,R,Land,"Dragonskull Summit enters the battlefield tapped unless you control a Swamp or a Mountain.
T: Add B or R to your mana pool."
Drowned Catacomb,"",0,0,0,R,Land,"Drowned Catacomb enters the battlefield tapped unless you control a Island or Swamp.
T: Add U or B to your mana pool."
Gargoyle Castle,"",0,0,0,R,Land,"T: Add 1 to your mana pool.
5, T, Sacrifice Gargoyle Castle: Put a 3/4 colorless Gargoyle artifact creature token with flying onto the battlefield."
Glacial Fortress,"",0,0,0,R,Land,"Glacial Fortress enters the battlefield tapped unless you control a Plains or an Island.
T: Add W or U to your mana pool."
Rootbound Crag,"",0,0,0,R,Land,"Rootbound Crag enters the battlefield tapped unless you control a Mountain or a Forest.
T: Add R or G to your mana pool."
Sunpetal Grove,"",0,0,0,R,Land,"Sunpetal Grove enters the battlefield tapped unless you control a Forest or Plains.
T: Add G or W to your mana pool."
Terramorphic Expanse,"",0,0,0,C,Land,"T, Sacrifice Terramorphic Expanse: Search your library for a basic land card and put it onto the battlefield tapped. Then shuffle your library."
Plains,"",0,0,0,L,Basic Land - Plains,[W]
Island,"",0,0,0,L,Basic Land - Island,[U]
Swamp,"",0,0,0,L,Basic Land - Swamp,[B]
Mountain,"",0,0,0,L,Basic Land - Mountain,[R]
Forest,"",0,0,0,L,Basic Land - Forest,[G]
