Khalni Garden,"",0,0,0,C,Land,"Khalni Garden enters the battlefield tapped.

When Khalni Garden enters the battlefield, put a 0/1 green Plant creature token onto the battlefield.
T: Add G to your mana pool."
Lavaclaw Reaches,"",0,0,0,R,Land,"Lavaclaw Reaches enters the battlefield tapped.
T: Add B or R to your mana pool.
1BR: Until end of turn, Lavaclaw Reaches becomes a 2/2 black and red Elemental creature with ""X: This creature gets +X/+0 until end of turn."" It’s still a land."
Quicksand,"",0,0,0,C,Land,"T: Add 1 to your mana pool.
T, Sacrifice Quicksand: Target attacking creature without flying gets -1/-2 until end of turn."
Raging Ravine,"",0,0,0,R,Land,"Raging Ravine enters the battlefield tapped.
T: Add R or G to your mana pool.
2RG: Until end of turn, Raging Ravine becomes a 3/3 red and green Elemental creature with ""Whenever this creature attacks, put a +1/+1 counter on it."" It’s still a land."
Sejiri Steppe,"",0,0,0,C,Land,"Sejiri Steppe enters the battlefield tapped.

When Sejiri Steppe enters the battlefield, you may have target creature gain protection from the color of your choice until end of turn.
T: Add W to your mana pool."
Smoldering Spires,"",0,0,0,C,Land,"Smoldering Spires enters the battlefield tapped.

When Smoldering Spires enters the battlefield, target creature can't block until end of turn.
T: Add R to your mana pool."
Stirring Wildwood,"",0,0,0,R,Land,"Stirring Wildwood enters the battlefield tapped.
T: Add G or W to your mana pool.
1GW: Until end of turn, Stirring Wildwood becomes a 3/4 green and white Elemental creature with reach. It's still a land."
Tectonic Edge,"",0,0,0,U,Land,"T: Add 1 to your mana pool.
1, T: Sacrifice Tectonic Edge: Destroy target nonbasic land. Activate this ability only if an opponent controls four or more lands."
